{
  "profile": {
    "candidate_id": "CAN-88421",
    "personal_info": {
      "full_name": "Rahul Sharma",
      "email": "rahul.sharma@email.com",
      "phone": "+91-98765-43210",
      "location": "Bangalore, India",
      "linkedin_url": "https://linkedin.com/in/rahulsharma-dev"
    },
    "summary": "Software engineer with 4.5 years of experience building backend services and cloud-native applications on Azure. Strong Python and Kubernetes skills with proven track record of performance optimization.",
    "experience": [
      {
        "company": "Infosys Limited",
        "title": "Senior Software Engineer",
        "start_date": "2022-01-15",
        "end_date": null,
        "is_current": true,
        "description": "Designed REST microservices in Python serving 2M daily requests. Deployed services on Azure AKS with Docker/Kubernetes. Reduced API latency 35% via query optimization and Redis caching.",
        "skills_used": [
          "Python",
          "REST",
          "Docker",
          "Kubernetes",
          "Azure",
          "PostgreSQL",
          "Redis"
        ]
      },
      {
        "company": "Tata Consultancy Services",
        "title": "Software Engineer",
        "start_date": "2020-06-01",
        "end_date": "2021-12-31",
        "is_current": false,
        "description": "Built CI/CD pipelines using Azure DevOps. Developed SQL reporting modules for enterprise banking clients.",
        "skills_used": [
          "Python",
          "Azure DevOps",
          "SQL",
          "Java"
        ]
      }
    ],
    "education": [
      {
        "institution": "Visvesvaraya Technological University",
        "degree": "B.Tech",
        "field_of_study": "Computer Science",
        "graduation_date": "2020-05-15",
        "gpa": "8.4/10"
      }
    ],
    "skills": [
      "Python",
      "Java",
      "REST APIs",
      "Docker",
      "Kubernetes",
      "Azure",
      "PostgreSQL",
      "Git",
      "CI/CD",
      "Microservices"
    ],
    "certifications": [
      "AZ-900: Azure Fundamentals",
      "CKA: Certified Kubernetes Administrator"
    ],
    "extraction_metadata": {
      "confidence_aggregate": 0.94,
      "prompt_version": "1.0.0",
      "extracted_at": "2026-08-03T09:18:42Z"
    }
  },
  "field_confidence": [
    {
      "pointer": "/education/0/institution",
      "confidence": 0.95
    },
    {
      "pointer": "/experience/0/company",
      "confidence": 0.97
    },
    {
      "pointer": "/experience/0/start_date",
      "confidence": 0.91
    },
    {
      "pointer": "/experience/0/title",
      "confidence": 0.96
    },
    {
      "pointer": "/experience/1/company",
      "confidence": 0.95
    },
    {
      "pointer": "/experience/1/end_date",
      "confidence": 0.57
    },
    {
      "pointer": "/personal_info/email",
      "confidence": 0.98
    },
    {
      "pointer": "/personal_info/full_name",
      "confidence": 0.99
    },
    {
      "pointer": "/personal_info/location",
      "confidence": 0.96
    },
    {
      "pointer": "/personal_info/phone",
      "confidence": 0.94
    },
    {
      "pointer": "/skills",
      "confidence": 0.92
    }
  ],
  "conflicts": [],
  "extraction_metadata": {
    "ocr_used": false,
    "pages_processed": 1,
    "source_char_count": 945,
    "content_sha256": "0000000000000000000000000000000000000000000000000000000000000000",
    "locale_detected": "en-IN",
    "truncated": false
  },
  "excluded_signals": [
    "photograph",
    "date_of_birth",
    "marital_status",
    "gender"
  ],
  "evidence": [
    {
      "field": "personal_info.full_name",
      "pointer": "/profile/personal_info/full_name",
      "snippet": "RAHUL SHARMA",
      "source_location": "page 1"
    },
    {
      "field": "personal_info.email",
      "pointer": "/profile/personal_info/email",
      "snippet": "Email: rahul.sharma@email.com | Phone: +91-98765-43210",
      "source_location": "page 1"
    },
    {
      "field": "personal_info.phone",
      "pointer": "/profile/personal_info/phone",
      "snippet": "Email: rahul.sharma@email.com | Phone: +91-98765-43210",
      "source_location": "page 1"
    },
    {
      "field": "experience[0].title",
      "pointer": "/profile/experience/0/title",
      "snippet": "Senior Software Engineer",
      "source_location": "page 1",
      "char_start": 0,
      "char_end": 24,
      "match_score": 1.0
    },
    {
      "field": "experience[0].company",
      "pointer": "/profile/experience/0/company",
      "snippet": "Infosys Limited",
      "source_location": "page 1",
      "match_score": 1.0
    },
    {
      "field": "skills.kubernetes",
      "pointer": "/profile/skills/4",
      "snippet": "Deployed services on Azure AKS with Docker/Kubernetes",
      "source_location": "page 1",
      "match_score": 0.98
    }
  ]
}
